Nome,PreçoFull,PreçoDisc
"Monitor Gamer Curvo Samsung 49"" Odyssey HDMI Display Port HDR1000 LC49RG90SSLXZD 120Hz 4ms",R$8999.00,R$7108.20
"Smart TV Samsung 75"" Neo QLED 8K Tela sem limites Som em Movimento Única Conexão QN75QN800BGXZD",R$29999.00,R$17369.10
Espremedor de Frutas Cuisinart Pulp Control CCJ-500 25W 110V Inox,R$499.00,R$224.55
Espremedor De Frutas Mondial Premium 127V Preto,R$69.90,R$56.05
Espremedor de Frutas Cuisinart Pulp Control CCJ-500 25W 110V Inox,R$499.00,R$224.55
"Smartphone Motorola Moto Edge 30 Pro 5G 256 GB 6.7"" Azul",R$6499.00,R$5849.10
